{
  "contract": "ai-sow-input-revision-v1",
  "revisionId": "revision-demo-extension",
  "requestSha256": "aaaaaaaaaaaaaaaaaaaaaaaaaaaaaaaaaaaaaaaaaaaaaaaaaaaaaaaaaaaaaaaa",
  "templateSha256": "bbbbbbbbbbbbbbbbbbbbbbbbbbbbbbbbbbbbbbbbbbbbbbbbbbbbbbbbbbbbbbbb",
  "deliveryPolicySha256": "cccccccccccccccccccccccccccccccccccccccccccccccccccccccccccccccc",
  "executionPolicySha256": "dddddddddddddddddddddddddddddddddddddddddddddddddddddddddddddddd",
  "project": {"projectId": "project-refund", "name": "退款项目", "plannedEffectiveDate": "2026-10-01"},
  "priorSowState": "NOT_PROVIDED",
  "priorSowSha256s": [],
  "sources": [
    {
      "sourceId": "prd-main",
      "role": "PRD",
      "status": "APPROVED",
      "path": ".ai-sow/inputs/revisions/revision-demo-extension/sources/prd-main/source.md",
      "rawSha256": "1111111111111111111111111111111111111111111111111111111111111111",
      "parserId": "markdown-blocks",
      "parserVersion": "1",
      "blockIds": ["block-prd-main"]
    },
    {
      "sourceId": "hld-main",
      "role": "HLD",
      "status": "APPROVED",
      "path": ".ai-sow/inputs/revisions/revision-demo-extension/sources/hld-main/source.md",
      "rawSha256": "2222222222222222222222222222222222222222222222222222222222222222",
      "parserId": "markdown-blocks",
      "parserVersion": "1",
      "blockIds": ["block-hld-main"]
    },
    {
      "sourceId": "demo-refund",
      "role": "DEMO",
      "status": "SELECTED",
      "path": ".ai-sow/inputs/revisions/revision-demo-extension/sources/demo-refund/source.html",
      "rawSha256": "5555555555555555555555555555555555555555555555555555555555555555",
      "parserId": "html-events",
      "parserVersion": "1",
      "blockIds": ["block-demo-refund"]
    }
  ],
  "blocks": [
    {
      "blockId": "block-prd-main",
      "sourceId": "prd-main",
      "rawSha256": "1111111111111111111111111111111111111111111111111111111111111111",
      "contentSha256": "3333333333333333333333333333333333333333333333333333333333333333",
      "locator": "heading:退款范围",
      "primaryCoverageBlockId": "block-prd-main",
      "contextBlockIds": [],
      "structuralParentId": null,
      "extractionDisposition": "INCLUDED",
      "droppedContentCategories": []
    },
    {
      "blockId": "block-hld-main",
      "sourceId": "hld-main",
      "rawSha256": "2222222222222222222222222222222222222222222222222222222222222222",
      "contentSha256": "4444444444444444444444444444444444444444444444444444444444444444",
      "locator": "heading:目标架构",
      "primaryCoverageBlockId": "block-hld-main",
      "contextBlockIds": [],
      "structuralParentId": null,
      "extractionDisposition": "INCLUDED",
      "droppedContentCategories": []
    },
    {
      "blockId": "block-demo-refund",
      "sourceId": "demo-refund",
      "rawSha256": "5555555555555555555555555555555555555555555555555555555555555555",
      "contentSha256": "6666666666666666666666666666666666666666666666666666666666666666",
      "locator": "html/button[1]/text[1]",
      "primaryCoverageBlockId": "block-demo-refund",
      "contextBlockIds": [],
      "structuralParentId": null,
      "extractionDisposition": "INCLUDED",
      "droppedContentCategories": []
    }
  ]
}
